ID,,GUI,Back End Interface,Exercise Cache,Exercise Loader,Exercise File,JUnit,TOTAL,JUSTIFICATION,,,,,,,,,,,,,,,,,1,"As a user, I want to select exercises.",1,1,1,1,1,0,5,,*,,,,,,,,,,,,,,,,2,"As a user, I want to work on a exercise.",1,0,0,0,0,0,1,Can test without other modules.,*,,,,,,,,,,,,,,,,3,"As a user, I would to receive feedback.",1,1,1,0,0,1,4,We can test by manipulating the cache.,*,,,,,,,,,,,,,,,,4,"As a user, I want to see what the outputs should be.",1,1,0,1,1,0,4,same as description justification,,,,,,,,,,,,,,,,,5,"As a user, I want to see a description of the exercises.",1,1,0,1,1,0,4,We just need to have the loader load the description into the GUI,,,,,,,,,,,,,,,,,,"As a user, I want to see solutions.",,,,,,,,Out of scope,,,,,,,,,,,,,,,,,6,"As a user, I want to run my solutions.",1,1,1,0,0,1,4,Same as feedback,*,,,,,,,,,,,,,,,,,"As a user, I want to see completed exercises.",,,,,,,,Out of scope,,,,,,,,,,,,,,,,,,TOTAL,6,5,3,3,3,2,,,,,,,,,,,,,,,,,,,
